{
 "profile_version": 1,
 "name": "default",
 "description": "rules.DEFAULTS, all six in-scope types on, red light off",
 "applies_to": {
  "map": null,
  "site": null,
  "road_type": null,
  "scenario": null
 },
 "violations": {
  "no_parking": {
   "enabled": true,
   "params": {
    "min_s": 30.0,
    "max_kmh": 2.0,
    "close_gap_s": 2.0
   }
  },
  "zebra_crossing": {
   "enabled": true,
   "params": {
    "min_s": 10.0,
    "max_kmh": 2.0,
    "close_gap_s": 2.0
   }
  },
  "highway_stop": {
   "enabled": true,
   "params": {
    "min_s": 20.0,
    "max_kmh": 5.0,
    "close_gap_s": 2.0
   }
  },
  "wrong_way": {
   "enabled": true,
   "params": {
    "angle_deg": 150.0,
    "min_s": 0.16666666666666666,
    "min_back_m": 5.0,
    "min_kmh": 5.0,
    "confirm_gap_s": 0.3,
    "close_gap_s": 2.0
   }
  },
  "illegal_u_turn": {
   "enabled": true,
   "params": {
    "turn_deg": 160.0,
    "flip_deg": 90.0,
    "anywhere": true,
    "window_s": 30.0,
    "settle_s": 5.0,
    "no_u_turn_junctions": []
   }
  },
  "speeding": {
   "enabled": true,
   "params": {
    "min_s": 0.3333333333333333,
    "sigmas": 2.0,
    "tolerance": "none",
    "confirm_gap_s": 0.2,
    "close_gap_s": 2.0,
    "class_limits_kmh": {},
    "min_track_age_s": 1.0,
    "max_speed_kmh": 0.0
   }
  },
  "lane_violation": {
   "enabled": true,
   "params": {
    "straddle_s": 3.0,
    "min_overlap_m": 0.3,
    "min_kmh": 5.0,
    "stable_s": 0.5,
    "exit_frac": 0.35,
    "confirm_gap_s": 0.5,
    "close_gap_s": 1.0,
    "unsafe_ttc_s": 2.0,
    "high_risk_ttc_s": 1.0,
    "unsafe_window_s": 1.0,
    "min_closing_mps": 0.5,
    "unsafe_min_kmh": 15.0,
    "min_below_s": 0.3,
    "overlap_margin_m": 0.3,
    "junction_min_s": 1.0,
    "junction_max_s": 20.0,
    "restricted_min_s": 1.0,
    "restricted_exempt": {
     "bus": [
      "bus"
     ],
     "emergency": [],
     "restricted": []
    },
    "shoulder_min_s": 3.0,
    "shoulder_min_kmh": 10.0
   }
  },
  "red_light": {
   "enabled": false,
   "params": {
    "min_kmh": 5.0,
    "max_gap_s": 0.5,
    "sure_after_s": 1.0,
    "exempt_classes": [],
    "enter_m": 10.0,
    "stop_kmh": 3.0,
    "confirm_s": 10.0
   }
  }
 },
 "conditions": {},
 "place_memory": {
  "radius_m": 1.5,
  "keep_s": 30.0,
  "vacate_kmh": 8.0,
  "vacate_beyond_m": 1.0
 },
 "modules": {
  "static_check": true,
  "evidence_clips": true,
  "learn_flow": false,
  "red_light": false,
  "pedestrians": false,
  "surface_anomalies": false
 }
}
